,source,author,title,description,url,urlToImage,publishedAt,content
72,"{'id': None, 'name': 'Barchart.com'}",Rich Asplund,Crude Oil Posts Modest Gains on Energy Demand Optimism,"August WTI crude oil (CLQ25 ) on Wednesday closed up +0.05 (+0.07%), and August RBOB gasoline (RBQ25 ) closed up +0.0029 (+0.13%). Crude oil and gasoline...",https://www.barchart.com/story/news/33307253/crude-oil-posts-modest-gains-on-energy-demand-optimism,https://s.yimg.com/ny/api/res/1.2/WcuIvLCux1NTgnh1FCG__w--/YXBwaWQ9aGlnaGxhbmRlcjt3PTEyMDA7aD04MDA-/https://media.zenfs.com/en/barchart_com_477/ca88e087f12a3f8d2cc35756e5cb650e,2025-07-09T19:31:13Z,"Oil tanker in open sea by StockStudio via Shutterstock
August WTI crude oil (CLQ25) on Wednesday closed up +0.05 (+0.07%), and August RBOB gasoline (RBQ25) closed up +0.0029 (+0.13%).
Crude oil and… [+3922 chars]"
73,"{'id': None, 'name': 'NPR'}",Anas Baba,"Knives, bullets and thieves: the quest for food in Gaza","NPR's Gaza producer faced Israeli military fire, private U.S. contractors pointing laser beams at his forehead and masked thieves as he tried to get food from a U.S.-supported group.",https://www.npr.org/2025/07/06/g-s1-75874/gaza-food-hunger-ghf,https://npr.brightspotcdn.com/dims3/default/strip/false/crop/6720x3780+0+350/resize/1400/quality/100/format/jpeg/?url=http%3A%2F%2Fnpr-brightspot.s3.amazonaws.com%2F85%2F61%2F58487bb041c2a4e8747f6869b4dc%2Fgettyimages-2221145339.jpg,2025-07-06T13:40:57Z,Editor's note: Anas Baba is NPR's producer in the Gaza Strip. His report is a rare account by a journalist inside a new food distribution site that the United States and Israel helped establish in th… [+10101 chars]
74,"{'id': None, 'name': 'Thedailyupside.com'}",Brian Boyle,OPEC+ Wants to Pump Its Way Back to the Top,"After roughly two straight years of production cuts to prop up falling prices, the oil cartel's newest problem is a shrinking market share.",https://www.thedailyupside.com/industries/energy/opec-wants-to-pump-its-way-back-to-the-top/,https://s.yimg.com/ny/api/res/1.2/sFgIsYstgYt5N4DNGWbzng--/YXBwaWQ9aGlnaGxhbmRlcjt3PTEyMDA7aD02NzU-/https://media.zenfs.com/en/the_daily_upside_435/c540669b9ccf957c3d335b1d3dd7b174,2025-07-03T04:01:00Z,"Photo by Getty Images via Unsplash
The oil-producing cartel OPEC+ seems to have a new mantra right in time for the summer: Just go with the flow. And right now, the oil pumps are flowing.
On Sunday… [+3219 chars]"
75,"{'id': None, 'name': 'Yahoo Entertainment'}",John Csiszar,"If You Had Invested in Oil Stocks During the Gulf War in the 1990s, Here’s How Much You’d Have Today","Oil prices initially spiked when the Gulf War began on August 2, 1990, as investors feared a global supply shutdown. However, as those fears subsided...",https://finance.yahoo.com/news/had-invested-oil-stocks-during-140409293.html,https://s.yimg.com/ny/api/res/1.2/YCaqd_gTkk22__WBDJv8XA--/YXBwaWQ9aGlnaGxhbmRlcjt3PTEyMDA7aD02NzU-/https://media.zenfs.com/en/gobankingrates_644/fa610cb006bd69b75586ace335492cc2,2025-07-11T14:04:09Z,"Oil prices initially spiked when the Gulf War began on August 2, 1990, as investors feared a global supply shutdown. However, as those fears subsided throughout the conflict, oil prices began steadil… [+3061 chars]"
76,"{'id': None, 'name': 'Barchart.com'}",Rich Asplund,Crude Oil Price Fall on Concern About Energy Demand,"August WTI crude oil (CLQ25 ) on Tuesday closed down -0.99 (-1.47%), and August RBOB gasoline (RBQ25 ) closed down -0.0300 (-1.41%). Crude oil and gasoline...",https://www.barchart.com/story/news/33565865/crude-oil-price-fall-on-concern-about-energy-demand,https://s.yimg.com/ny/api/res/1.2/2Nc6sv9BGm5iOVVR1TyL8w--/YXBwaWQ9aGlnaGxhbmRlcjt3PTEyMDA7aD04MDA-/https://media.zenfs.com/en/barchart_com_477/2831b0f46d658ccd7a821e1ab27a2042,2025-07-22T19:30:05Z,"Offshore oil platform in ocean by Wirestock via iStock
August WTI crude oil (CLQ25) on Tuesday closed down -0.99 (-1.47%), and August RBOB gasoline (RBQ25) closed down -0.0300 (-1.41%).
Crude oil a… [+4907 chars]"
77,"{'id': None, 'name': 'Forbes'}","Ian Dexter Palmer, Ph.D., Contributor, 
 Ian Dexter Palmer, Ph.D., Contributor
 https://www.forbes.com/sites/ianpalmer/",Black Oil And Green Energy In Mega Bill Will Boost Oil But Cost U.S.,This policy will lead to more expensive electricity in the U.S. and a serious delay in the race against China for AI dominance.,https://www.forbes.com/sites/ianpalmer/2025/07/14/black-oil-and-green-energy-in-mega-bill-will-boost-oil-but-cost-us/,https://imageio.forbes.com/specials-images/imageserve/6875015b3833d6460acda11e/0x0.jpg?format=jpg&height=900&width=1600&fit=bounds,2025-07-14T13:15:16Z,"Workers extracting oil in the Permian Basin in Midland, Texas. 
Getty Images
Energy policy in the U.S. has changed dramatically since OBBBA (One Big Beautiful Bill Act) has been signed into law. Th… [+6567 chars]"
78,"{'id': None, 'name': 'Vox'}",Umair Irfan,Why your energy bill is suddenly so much more expensive,"Americans are paying more for electricity, and those prices are set to rise even further. In almost all parts of the country, the amount people pay for electricity on their power bills — the retail price — has risen faster than the rate of inflation since 202…",https://www.vox.com/climate/420887/electricity-energy-bill-expensive-prices-rising,https://platform.vox.com/wp-content/uploads/sites/2/2025/07/GettyImages-1316185179.jpg?quality=90&strip=all&crop=0%2C10.732984293194%2C100%2C78.534031413613&w=1200,2025-07-23T22:42:20Z,"Energy infrastructure is increasingly driving higher electricity prices.


Americans are paying more for electricity, and those prices are set to rise even further.

In almost all parts of the count… [+7876 chars]"
79,"{'id': None, 'name': 'CNET'}",Katherine Watt,Mortgage Predictions for July: Will Rates Continue Falling?,"Fed rate cuts are still on the table this year, but stronger-than-expected job data will keep policymakers on hold this month.",https://www.cnet.com/personal-finance/mortgages/mortgage-predictions-for-july-will-rates-continue-falling/,https://www.cnet.com/a/img/resize/27c21aabdaf21bc6fd1e86e53460fd518c98f558/hub/2024/07/29/5090ba2f-9272-47a1-8cdf-a914b00cd178/weekly-mortgage-predictions-4.jpg?auto=webp&fit=crop&height=675&width=1200,2025-07-03T12:51:00Z,"Buyers should keep an eye on the possibility of rate cuts in the next few months. 
Tharon Green/CNET
Mortgage rates are holding near a two-month low, with average 30-year fixed rates having fallen … [+6215 chars]"
80,"{'id': None, 'name': 'Yahoo Entertainment'}",Jason Ma,Wall Street was expecting a TACO Tuesday. But Dow futures fall 250 points after Trump says he will set tariffs as high as 70%,"Trump said that about “10 or 12” tariff letters would go out Friday, with additional letters coming “over the next few days.”",https://finance.yahoo.com/news/wall-street-expecting-taco-tuesday-174415034.html,https://s.yimg.com/ny/api/res/1.2/zLKCnPNpRMPcTtW6NM.dPg--/YXBwaWQ9aGlnaGxhbmRlcjt3PTEyMDA7aD04MDA-/https://media.zenfs.com/en/fortune_175/7302e4cb37c4c87fc6f625149e278a1d,2025-07-04T17:44:15Z,"<ul><li>While U.S. markets were closed for the July 4 holiday, stock futures sank on Friday after President Donald Trump said he will start sending out letters informing countries of what tariffs the… [+3107 chars]"
81,"{'id': None, 'name': 'Thekitchn.com'}",Micki Wagner,I Buy Bag After Bag of This Beloved $6 Snack All the Way from Greece,"It’s sweet, crunchy, and nutty.
READ MORE...",https://www.thekitchn.com/primis-imports-pasteli-with-greek-pistachio-review-23735317,"https://cdn.apartmenttherapy.info/image/upload/f_auto,q_auto:eco,c_fill,g_auto,w_1500,ar_3:2/stock%2Fshutterstock_289814858",2025-07-14T14:30:00Z,"We independently select these products—if you buy from one of our links, we may earn a commission. All prices were accurate at the time of publishing.
One of my favorite things to do when I travel i… [+2575 chars]"
82,"{'id': None, 'name': 'Thekitchn.com'}",Micki Wagner,"This Popular Air Fryer Is on Major Sale for Prime Day (It Has More Than 30,300 Five-Star Ratings)","It’s 43% off!
READ MORE...",https://www.thekitchn.com/best-chefman-multifunctional-air-fryer-deal-2025-23734462,"https://cdn.apartmenttherapy.info/image/upload/f_auto,q_auto:eco,c_fill,g_auto,w_1500,ar_3:2/k%2FPhoto%2FRecipes%2F2021-02-air-fryer-chicken-breasts%2F2021-02-16_ATK109315_193440_cropped-2",2025-07-09T10:15:00Z,"We independently select these products—if you buy from one of our links, we may earn a commission. All prices were accurate at the time of publishing.
I firmly believe an air fryer is a kitchen must… [+2368 chars]"
83,"{'id': None, 'name': 'Thekitchn.com'}",Micki Wagner,"The New Jarred “Saturday Sauce” Is So Delicious, I Can’t Imagine Breakfast, Lunch or Dinner Without It","I buy two jars at a time.
READ MORE...",https://www.thekitchn.com/sababa-foods-slightly-spicy-saturday-sauce-review-23737394,"https://cdn.apartmenttherapy.info/image/upload/f_auto,q_auto:eco,c_fill,g_auto,w_1500,ar_3:2/k%2FPhoto%2FRecipes%2F2024-09-shakshuka%2Fshakshuka-159",2025-07-25T13:30:00Z,"We independently select these products—if you buy from one of our links, we may earn a commission. All prices were accurate at the time of publishing.
I always keep an eye out for easy ways to amp u… [+2918 chars]"
84,"{'id': None, 'name': 'Thekitchn.com'}",Patty Catalano,"I’m a Professional Cook, and This Is the $6 Aldi Dessert I Always Have in My Freezer (It Tastes Homemade)","They come in a container of … 50!
READ MORE...",https://www.thekitchn.com/aldi-specially-selected-mini-cream-puffs-review-23732424,"https://cdn.apartmenttherapy.info/image/upload/f_auto,q_auto:eco,c_fill,g_auto,w_1500,ar_3:2/stock%2Fshutterstock_1672603831-tk",2025-07-01T12:30:00Z,"We independently select these products—if you buy from one of our links, we may earn a commission. All prices were accurate at the time of publishing.
Shopping at Aldi has been a part of my grocery … [+2616 chars]"
85,"{'id': None, 'name': 'Thekitchn.com'}",Barbara Bellesi Zito,8 Kitchen Items You’ll Wish You Brought on Your Next Vacation (They Can Save You Money!),"It’ll save you money!
READ MORE...",https://www.thekitchn.com/kitchen-travel-staples-23733193,"https://cdn.apartmenttherapy.info/image/upload/f_auto,q_auto:eco,c_fill,g_auto,w_1500,ar_3:2/stock%2FGettyImages-1408268678",2025-07-01T12:45:00Z,"We independently select these products—if you buy from one of our links, we may earn a commission. All prices were accurate at the time of publishing.
A good home cook might feel comfortable in any … [+6155 chars]"
86,"{'id': None, 'name': 'Biztoc.com'}",bostonherald.com,Ticker: OPEC+ to boost oil production; China bans EU medical devices,"Eight members of the OPEC+ alliance of oil exporting countries say they will boost production by 548,000 barrels per day in August in a move that could further reduce gas prices this year.
The group that includes Saudi Arabia and Russia made the decision at a…",https://biztoc.com/x/9c987718179b52d1,https://biztoc.com/cdn/9c987718179b52d1_s.webp,2025-07-06T20:50:29Z,"Eight members of the OPEC+ alliance of oil exporting countries say they will boost production by 548,000 barrels per day in August in a move that could further reduce gas prices this year.The group t… [+147 chars]"
87,"{'id': None, 'name': 'Barchart.com'}",Rich Asplund,Crude Oil Prices Tumble as Trump Remains Patient with Putin,"August WTI crude oil (CLQ25 ) on Monday closed down -1.47 (-2.15%), and August RBOB gasoline (RBQ25 ) closed down -0.0216 (-0.99%). Crude oil and gasoline...",https://www.barchart.com/story/news/33391492/crude-oil-prices-tumble-as-trump-remains-patient-with-putin,https://s.yimg.com/ny/api/res/1.2/E1Kubv61NupvScF4KYD8Nw--/YXBwaWQ9aGlnaGxhbmRlcjt3PTEyMDA7aD04MDA-/https://media.zenfs.com/en/barchart_com_477/99e8e3c6d2e06ec35074ee48fccb3ffd,2025-07-14T19:21:04Z,"Oil pipeline in winter by Robson Machado via Pixabay
August WTI crude oil (CLQ25) on Monday closed down -1.47 (-2.15%), and August RBOB gasoline (RBQ25) closed down -0.0216 (-0.99%).
Crude oil and … [+4540 chars]"
88,"{'id': None, 'name': 'Forbes'}","Michael Lynch, Senior Contributor, 
 Michael Lynch, Senior Contributor
 https://www.forbes.com/sites/michaellynch/",The Risks Around The Alaskan LNG Project,"The proposed Alaskan LNG Project is expensive but attractive. To the extent that it relies on political pressure, it is vulnerable to changing conditions.",https://www.forbes.com/sites/michaellynch/2025/07/25/the-risks-around-the-alaskan-lng-project/,https://imageio.forbes.com/specials-images/imageserve/6882705d70b35bf2de9eafa8/0x0.jpg?format=jpg&height=900&width=1600&fit=bounds,2025-07-25T09:00:00Z,"General view of the Trans-Alaska pipeline terminal at Valdez, Alaska, July 29th 1977. (Photo by ... More UPI/Bettmann Archive/Getty Images)
Getty Images
The North Slope of Alaska contains a large u… [+12256 chars]"
89,"{'id': None, 'name': 'Biztoc.com'}",financialpost.com,Nutella fans brace for price hike as Turkish frost hits hazelnut harvest,"First olive oil, then cocoa and coffee. Now a fresh supply squeeze is set to hit another food pleasure — the hazelnuts that go into making the chocolaty 
 
 
 
 
 
 
 
 
 
 Nutella spread. 
 Wholesale prices in Turkey, which accounts for around 65 per cent of…",https://biztoc.com/x/015f40115d5d54bb,https://biztoc.com/cdn/015f40115d5d54bb_s.webp,2025-07-04T18:24:15Z,"First olive oil, then cocoa and coffee. Now a fresh supply squeeze is set to hit another food pleasure the hazelnuts that go into making the chocolaty 
Nutella spread. Wholesale prices in Turkey, wh… [+130 chars]"
90,"{'id': None, 'name': 'Thekitchn.com'}",Shannon Feulner,"This Southern Cake Is So Good, All Your Friends Will Demand Two Slices","And it’s semi-homemade.
READ MORE...",https://www.thekitchn.com/mandarin-orange-cake-23734231,"https://cdn.apartmenttherapy.info/image/upload/f_auto,q_auto:eco,c_fill,g_auto,w_1500,ar_3:2/tk%2Fphoto%2F2025%2F07-2025%2F2025-07-mandarin-orange-cake%2Fmandarin-orange-cake-058",2025-07-13T15:00:00Z,"We independently select these products—if you buy from one of our links, we may earn a commission. All prices were accurate at the time of publishing.
I grew up making boxed yellow cake with my mom … [+7816 chars]"
91,"{'id': None, 'name': ""Investor's Business Daily""}",,"These Fossil Fuels Stocks Rallied As Senate Passed Trump's Tax, Spending Plan",Fossil fuel-related stocks in the coal and oil drilling sectors soared in Wednesday's stock market.,https://www.investors.com/news/fossil-fuels-stocks-rallied-as-senate-passed-trumps-tax-spending-plan/,https://www.investors.com/wp-content/uploads/2021/10/Stock-oilderrick-02-adobe.jpg,2025-07-03T12:42:47Z,"Information in Investors Business Daily is for informational and educational purposes only and should not be construed as an offer, recommendation, solicitation, or rating to buy or sell securities. … [+1064 chars]"
92,"{'id': None, 'name': 'Yahoo Entertainment'}",,Crude Oil Prices Remain Weak on Lack of Fresh Russian Sanctions,,https://consent.yahoo.com/v2/collectConsent?sessionId=1_cc-session_cd344550-ad05-46fb-b40e-9417526c153d,,2025-07-15T19:21:49Z,"If you click 'Accept all', we and our partners, including 236 who are part of the IAB Transparency &amp; Consent Framework, will also store and/or access information on a device (in other words, use … [+714 chars]"
93,"{'id': None, 'name': 'Yahoo Entertainment'}",,Crude Prices Jump on Speculation About New US Sanctions on Russian Oil Exports,,https://consent.yahoo.com/v2/collectConsent?sessionId=1_cc-session_6eca0379-6642-496a-9dc5-13f8673f72cc,,2025-07-11T19:12:39Z,"If you click 'Accept all', we and our partners, including 236 who are part of the IAB Transparency &amp; Consent Framework, will also store and/or access information on a device (in other words, use … [+714 chars]"
94,"{'id': None, 'name': 'Yahoo Entertainment'}",Reuters,Oil prices little changed as investors eye impact of new sanctions on Russia,"SINGAPORE (Reuters) -Oil prices barely budged on Monday as traders eyed the impact of new European sanctions on Russian oil supply, rising output from Middle...",https://finance.yahoo.com/news/oil-prices-little-changed-investors-005622037.html,https://media.zenfs.com/en/reuters-finance.com/86f9eb8f378811ee198cd3205b4611eb,2025-07-21T00:56:22Z,"SINGAPORE (Reuters) -Oil prices barely budged on Monday as traders eyed the impact of new European sanctions on Russian oil supply, rising output from Middle East producers and concerns about fuel ou… [+1560 chars]"
95,"{'id': None, 'name': 'Biztoc.com'}",southernliving.com,Amazon Surprised Us By Slashing Prices On Stunning Porch And Patio Decor Ahead Of Prime Day,,https://biztoc.com/x/71b2c9f5da46e27d,https://biztoc.com/cdn/950/og.png,2025-07-05T21:24:35Z,"{ window.open(this.href, '_blank'); }, 200); return false;""&gt;Why did Trump delay TikTok ban enforcement? { window.open(this.href, '_blank'); }, 200); return false;""&gt;How will OPEC+ oil output inc… [+712 chars]"
96,"{'id': None, 'name': 'Yahoo Entertainment'}",Sultan Khalid,Is Chevron (CVX) a Good Investment for Passive Income?,Chevron Corporation (NYSE:CVX) is included among the 12 Best Oil and Gas Dividend Stocks to Buy Now. One of the largest oil and gas producers in the world...,https://finance.yahoo.com/news/chevron-cvx-good-investment-passive-150929539.html,https://s.yimg.com/ny/api/res/1.2/59x66RzfU_SABRbIkb_qng--/YXBwaWQ9aGlnaGxhbmRlcjt3PTEyMDA7aD02NzM-/https://media.zenfs.com/en/insidermonkey.com/9993985ff21c88fc97966aed5b1501d8,2025-07-21T15:09:29Z,"Chevron Corporation (NYSE:CVX) is included among the 12 Best Oil and Gas Dividend Stocks to Buy Now.
Is Chevron (CVX) a Good Investment for Passive Income?
An aerial view of an oil rig at sea, the … [+1626 chars]"
97,"{'id': None, 'name': 'Yahoo Entertainment'}",Geoffrey Morgan,Wall Street Is Stubbornly Bullish on Downtrodden Energy Stocks,"(Bloomberg) -- Wall Street analysts have high hopes for oil and gas stocks, encouraged by cheap valuations and President Donald Trump’s boosterism of the...",https://finance.yahoo.com/news/wall-street-stubbornly-bullish-downtrodden-093000978.html,https://s.yimg.com/ny/api/res/1.2/Fo.EXmOTeuah6OEUlO_1yA--/YXBwaWQ9aGlnaGxhbmRlcjt3PTEyMDA7aD04MDc-/https://media.zenfs.com/en/bloomberg_holding_pen_162/1404a5f54fd81c80176e06b5fe86e7d0,2025-07-22T09:30:00Z,"(Bloomberg) Wall Street analysts have high hopes for oil and gas stocks, encouraged by cheap valuations and President Donald Trumps boosterism of the beleaguered energy sector.
Most Read from Bloomb… [+2290 chars]"
