,source,author,title,description,url,urlToImage,publishedAt,content
0,"{'id': 'wired', 'name': 'Wired'}",Boutayna Chokrane,"Best Prime Day Beauty Deals 2025: Hair, Skin, and Dental Care","Prime Day’s beauty bargains are live. We tested the gadgets, tracked the prices, and scanned hundreds of deals to find what’s actually worth it.",https://www.wired.com/story/prime-day-beauty-deals-july-2025-2/,"https://media.wired.com/photos/68646b56182925dd2869675f/191:100/w_1280,c_limit/12.jpg",2025-07-10T19:56:08Z,"Amazon Prime Day runs from July 8 to 11, and its a feeding frenzy for beauty steals, so Im here to help you spend your money semi-responsibly. Ive combed through countless hot tools, dental devices, … [+7473 chars]"
1,"{'id': 'wired', 'name': 'Wired'}",Simon Hill,Prime Day Picks From People Who Obsessively Test Gear & Track Prices,"We review products year-round and spend weeks evaluating Prime Day deals to pick the best bargains on quality gadgets. Don't waste your money, shop real sales!",https://www.wired.com/story/best-amazon-prime-deals-july-2025-1/,"https://media.wired.com/photos/686d4cbdffcb274e31f3ae3f/191:100/w_1280,c_limit/Absolute%20Best%20Deals.png",2025-07-09T09:12:33Z,"Amazon Prime Day began as one day and is now much more of an event, lasting four days this year. The Prime Day deals started dropping last month, and will go on through Friday. We'll be dangerously c… [+75338 chars]"
2,"{'id': None, 'name': 'Yahoo Entertainment'}",Stephanie Kelly,"Oil prices ease as traders assess US tariffs, OPEC+ output hike","(Reuters) -Oil prices eased on Tuesday after rising almost 2% in the previous session, as investors assessed new developments on U.S. tariffs and a higher...",https://uk.finance.yahoo.com/news/oil-prices-ease-traders-assess-005032732.html,https://media.zenfs.com/en/reuters.com/492edd41d108bd5f9b40709b5d9e33b0,2025-07-08T00:50:32Z,"By Stephanie Kelly
(Reuters) -Oil prices eased on Tuesday after rising almost 2% in the previous session, as investors assessed new developments on U.S. tariffs and a higher-than-expected OPEC+ outp… [+1886 chars]"
3,"{'id': None, 'name': 'Yahoo Entertainment'}",Editor OilPrice.com,OPEC Is Playing The Long Game,"OPEC is implementing a long-term strategy to regain market share and maintain high oil prices, leveraging geopolitical factors and a slowdown in non-OPEC...",https://finance.yahoo.com/news/opec-playing-long-game-230000878.html,https://s.yimg.com/cv/apiv2/social/images/yahoo_default_logo-1200x1200.png,2025-07-19T23:00:00Z,"“There is no peak in oil demand on the horizon,” the head of OPEC, Haitham al Ghais, said last month in Canada. Demand will continue to increase as global population grows, he added. And OPEC will be… [+5083 chars]"
4,"{'id': None, 'name': 'Yahoo Entertainment'}",Scott DiSavino,"US oil/gas rig count down for 11th week to lowest since 2021, Baker Hughes says",(Reuters) -U.S. energy firms this week cut the number of oil and natural gas rigs operating for an 11th week in a row for the first time since July 2020 when...,https://ca.finance.yahoo.com/news/us-oil-gas-rig-count-173929976.html,https://media.zenfs.com/en/reuters.com/a5ba59c0a8e22d9b195412d50fc94b3c,2025-07-11T17:39:29Z,"By Scott DiSavino
(Reuters) -U.S. energy firms this week cut the number of oil and natural gas rigs operating for an 11th week in a row for the first time since July 2020 when the COVID-19 pandemic … [+2179 chars]"
5,"{'id': None, 'name': 'Yahoo Entertainment'}",Bloomberg,"BofA Sees Oil Prices to Fall in Autumn, Blanch Says","Francisco Blanch, head of global commodities and derivates research at Bank of America, discusses OPEC+'s recent decision to increase oil production for the ...",https://finance.yahoo.com/video/bofa-sees-oil-prices-fall-080803016.html,https://s.yimg.com/ny/api/res/1.2/DwKJDfbXs9xpmtvHBVOhCQ--/YXBwaWQ9aGlnaGxhbmRlcjt3PTEyMDA7aD02NzU-/https://media.zenfs.com/en/bloomberg_markets_video_2/6cbd251f68b9ecb8a891786568fd84aa,2025-07-08T08:08:03Z,"Francisco Blanch, head of global commodities and derivates research at Bank of America, discusses OPEC+'s recent decision to increase oil production for the month of August. ""It's been a good time to… [+260 chars]"
6,"{'id': None, 'name': 'Yahoo Entertainment'}",Nilanjan Banerjee,3 Oilfield Stocks Well Poised to Gain Despite Industry Woes,"Strict capital discipline by upstream energy companies is acting as a dampener, making the outlook for the Zacks Oil and Gas- Field Services industry gloomy....",https://finance.yahoo.com/news/3-oilfield-stocks-well-poised-145000699.html,https://media.zenfs.com/en/zacks.com/a4cef322b4244c64f8adf4e0acb07e4c,2025-07-08T14:50:00Z,"A volatile pricing environment for commodities, driven by rising trade tensions and strict capital management by upstream energy firms, is diminishing the demand for oilfield services, creating a cha… [+6420 chars]"
7,"{'id': None, 'name': 'Thekitchn.com'}",Mackenzie Filson,We Compared Prices for 15 Items at Aldi Versus Walmart — And One Is Clearly Cheaper,"We looked at milk, butter, olive oil, frozen chicken nuggets, and more.
READ MORE...",https://www.thekitchn.com/is-aldi-cheaper-than-walmart-2025-23734199,"https://cdn.apartmenttherapy.info/image/upload/f_auto,q_auto:eco,c_fill,g_auto,w_1500,ar_3:2/tk%2Fedit%2Fgroceries%2F2025%2F2025-07%2Faldi-vs-walmart%2Faldi-vs-walmart-lead",2025-07-08T14:30:00Z,"We independently select these products—if you buy from one of our links, we may earn a commission. All prices were accurate at the time of publishing.
Before we get to number crunching, though, Ive … [+7384 chars]"
8,"{'id': None, 'name': 'MarketWatch'}",Myra P. Saefong,Fourth of July gas prices may be the lowest in years. Will they stay this cheap all summer?,U.S. drivers may pay the lowest Independence Day prices for gasoline at the pump since 2021. But whether cheaper fuel prices will stick around for the rest of the summer is a bit harder to predict.,https://www.marketwatch.com/story/fourth-of-july-gas-prices-may-be-the-lowest-in-years-will-they-stay-this-cheap-all-summer-3d31a193,https://images.mktw.net/im-568286/social,2025-07-02T11:00:00Z,"U.S. drivers may pay the lowest Independence Day prices for gasoline at the pump since 2021, as easing Israel-Iran tensions have helped pull oil lower. But whether cheaper fuel prices will stick arou… [+308 chars]"
9,"{'id': 'business-insider', 'name': 'Business Insider'}",William Edwards,2 former Fed economists say Chair Jerome Powell is facing an epic conundrum,"It hasn't been an easy start to 2025 for Jerome Powell. Unfortunately for the Fed chair, the second half of the year is likely to be even tougher.",https://www.businessinsider.com/fed-rate-cuts-inflation-jobs-jerome-powell-economy-recession-tariffs-2025-7,https://i.insider.com/68712f053d5881a51c1d2c4b?width=1200&format=jpeg,2025-07-13T09:30:01Z,"U.S. President Donald Trump gestures with Jerome Powell, his nominee to become chairman of the U.S. Federal Reserve at the White House in WashingtonReuters
<ul><li>Fed Chair Jerome Powell is facing … [+4899 chars]"
10,"{'id': None, 'name': 'Slashdot.org'}",BeauHD,Saudi Arabia Asks Consultants To Reassess Feasibility of 'The Line' Megaproject,"Saudi Arabia has asked consultants to reassess the feasibility of The Line, its ambitious 170km linear city project and centerpiece of the Neom initiative, as rising costs and falling oil prices force the kingdom to scale back its megaprojects. Middle East Ey…",https://news.slashdot.org/story/25/07/14/233200/saudi-arabia-asks-consultants-to-reassess-feasibility-of-the-line-megaproject,https://a.fsdn.com/sd/topics/money_64.png,2025-07-15T02:10:00Z,"Blocks / grids might be common in the US but they aren't super common in Europe, Middle East or Asia. A new city might have a central core (e.g. a palace, or central forum which was designed) designe… [+1313 chars]"
11,"{'id': None, 'name': 'Calculatedriskblog.com'}",Calculated Risk,Sunday Night Futures,"Weekend:  • Schedule for Week of June 29, 2025   Monday:  • At 9:45 AM ET, Chicago Purchasing Managers Index  for June.   • At 10:30 AM, Dal...",https://www.calculatedriskblog.com/2025/06/sunday-night-futures_29.html,,2025-06-29T23:08:00Z,"Weekend:• Schedule for Week of June 29, 2025
Monday:• At 9:45 AM ET, Chicago Purchasing Managers Index for June.
• At 10:30 AM, Dallas Fed Survey of Manufacturing Activity for June.
From CNBC: Pre… [+517 chars]"
12,"{'id': None, 'name': 'Calculatedriskblog.com'}",Calculated Risk,Sunday Night Futures,"Weekend:  • Schedule for Week of July 6, 2025   Monday:  • No major economic releases scheduled.   From CNBC: Pre-Market Data  and Bloomberg...",https://www.calculatedriskblog.com/2025/07/sunday-night-futures.html,,2025-07-06T22:17:00Z,"Weekend:• Schedule for Week of July 6, 2025
Monday:• No major economic releases scheduled.
From CNBC: Pre-Market Data and Bloomberg futures S&amp;P 500 are down 22 and DOW futures are down 112 (fai… [+427 chars]"
13,"{'id': None, 'name': 'Calculatedriskblog.com'}",Calculated Risk,Sunday Night Futures,"Weekend:  • Schedule for Week of July 20, 2025   Monday:  • No major economic releases scheduled.   From CNBC: Pre-Market Data  and Bloomber...",https://www.calculatedriskblog.com/2025/07/sunday-night-futures_20.html,,2025-07-20T22:21:00Z,"Weekend:• Schedule for Week of July 20, 2025
Monday:• No major economic releases scheduled.
From CNBC: Pre-Market Data and Bloomberg futures S&amp;P 500 are down 2 and DOW futures are down 33 (fair… [+428 chars]"
14,"{'id': None, 'name': 'Calculatedriskblog.com'}",Calculated Risk,Sunday Night Futures,"Weekend:  • Schedule for Week of July 20, 2025   Monday:  • At 10:00 AM ET, the Q2 2025 Housing Vacancies and Homeownership  from the Census...",https://www.calculatedriskblog.com/2025/07/sunday-night-futures_27.html,,2025-07-27T23:46:00Z,"Weekend:• Schedule for Week of July 20, 2025
Monday:• At 10:00 AM ET, the Q2 2025 Housing Vacancies and Homeownership from the Census Bureau.
• At 10:30 AM, Dallas Fed Survey of Manufacturing Activ… [+546 chars]"
15,"{'id': None, 'name': 'Calculatedriskblog.com'}",Calculated Risk,Sunday Night Futures,"Weekend:  • Schedule for Week of July 13, 2025   Monday:  • No major economic releases scheduled.   From CNBC: Pre-Market Data  and Bloomber...",https://www.calculatedriskblog.com/2025/07/sunday-night-futures_13.html,,2025-07-13T22:13:00Z,"Weekend:• Schedule for Week of July 13, 2025
Monday:• No major economic releases scheduled.
From CNBC: Pre-Market Data and Bloomberg futures S&amp;P 500 are down 26 and DOW futures are down 185 (fa… [+428 chars]"
16,"{'id': None, 'name': 'Yahoo Entertainment'}",Venkatesh,Energy Transfer Strengthens Dividend Following Export Policy Reversal,Energy Transfer LP (NYSE:ET) is one of the 12 Best MLP Dividend Stocks to Buy According to Analysts. BIS has rescinded the license requirement for exporting ...,https://finance.yahoo.com/news/energy-transfer-strengthens-dividend-following-131428312.html,https://s.yimg.com/ny/api/res/1.2/7unfpBxPKwE.0uHkDX7t9Q--/YXBwaWQ9aGlnaGxhbmRlcjt3PTEyMDA7aD02NzM-/https://media.zenfs.com/en/insidermonkey.com/a97f111c62451e82df1b503f29d424ac,2025-07-11T13:14:28Z,"Energy Transfer LP (NYSE:ET) is one of the 12 Best MLP Dividend Stocks to Buy According to Analysts.
BIS has rescinded the license requirement for exporting ethane to China or Chinese military end u… [+1792 chars]"
17,"{'id': 'business-insider', 'name': 'Business Insider'}",Huileng Tan,"Russia is pouring money into its war machine — but it's still struggling to create new, advanced systems",Russia is set to spend 6.3% of its GDP on defense this year — a post-Cold War high.,https://www.businessinsider.com/russia-economy-war-machine-military-defense-spending-advanced-systems-innovation-2025-7,https://i.insider.com/688072c8f748d8c055f61ab0?width=1200&format=jpeg,2025-07-23T09:35:55Z,"Russian President Vladimir Putin's administration has been spending record sums on military needs in recent years.Gavriil Grigorov/Pool/AFP/Getty Images
<ul><li>Russia's defense spending has hit rec… [+3863 chars]"
18,"{'id': None, 'name': 'Slashdot.org'}",BeauHD,CoreWeave Data Center To Double City's Power Needs,"An anonymous reader quotes a report from Bloomberg: CoreWeave is expanding a data center that is projected to double the electricity needs of a city near Dallas, another example of the strains that artificial intelligence workloads are placing on the US power…",https://hardware.slashdot.org/story/25/07/14/2337208/coreweave-data-center-to-double-citys-power-needs,https://a.fsdn.com/sd/topics/power_64.png,2025-07-15T13:00:00Z,"CoreWeave is expanding a data center that is projected to double the electricity needs of a city near Dallas, another example of the strains that artificial intelligence workloads are placing on the … [+2427 chars]"
19,"{'id': None, 'name': 'Volts.wtf'}",David Roberts,Solar+storage is so much farther along than you think,On how plummeting battery prices make 24/7 solar power a reality today.,https://www.volts.wtf/p/solarstorage-is-so-much-farther-along,"https://substackcdn.com/image/fetch/$s_!Ip8M!,w_1200,h_600,c_fill,f_jpg,q_auto:good,fl_progressive:steep,g_auto/https%3A%2F%2Fsubstack-video.s3.amazonaws.com%2Fvideo_upload%2Fpost%2F167237805%2Fbd7aab5a-219b-496e-ba7a-5e6fc36e873b%2Ftranscoded-1752615060.png",2025-07-21T16:31:57Z,"I chat with Kostantsa Rangelova and Dave Jones, authors of a new Ember report, who find that solar-plus-storage costs have declined so much that it can now provide baseload-level power in sunny citie… [+60171 chars]"
20,"{'id': None, 'name': 'BBC News'}",,​​What is inside the GHF aid box being distributed in Gaza,"BBC Verify examines aid boxes being handed out to Gazans, but their nutritional value is questioned by some experts.",https://www.bbc.com/news/articles/cd787er1qz4o,https://ichef.bbci.co.uk/news/1024/branded_news/7108/live/76572300-68a5-11f0-89ea-4d6f9851f623.jpg,2025-07-25T23:41:52Z,"Kevin Nguyen and Alex Murray
More than two million Palestinians in Gaza are facing a starvation crisis, with deaths from malnutrition rising by the day, according to the United Nations.
The Gaza Hu… [+4122 chars]"
21,"{'id': None, 'name': 'Yahoo Entertainment'}",Nissa Darbonne,Scott Sheffield Bashes Exxon Mobil After FTC Clears Him,"Former Pioneer Natural Resources CEO Scott Sheffield told Hart Energy, “For now, I remain one of Exxon’s largest individual shareholders and as such will...",https://finance.yahoo.com/news/scott-sheffield-bashes-exxon-mobil-103635654.html,https://s.yimg.com/ny/api/res/1.2/vbmWmKvSNu7CLtelli5taQ--/YXBwaWQ9aGlnaGxhbmRlcjt3PTEyMDA7aD05NTg-/https://media.zenfs.com/en/hart_energy_160/3bb51dc9c62f23dd8ebf2c458cac3fba,2025-07-18T10:36:35Z,"The Federal Trade Commission (FTC) revoked a 2024 decision prohibiting former Pioneer Natural Resources CEO Scott Sheffield from holding an Exxon Mobil position.
But after winning the clearance, She… [+3086 chars]"
22,"{'id': 'abc-news', 'name': 'ABC News'}",Max Zahn,"Inflation report to arrive as Trump, Fed disagree over tariff risks","Inflation has cooled this year, defying the fears of many economists.",https://abcnews.go.com/US/inflation-report-arrive-trump-fed-disagree-tariff-risks/story?id=123735983,https://i.abcnewsfe.com/a/b16761f0-a88e-4a2f-9f4a-fd9309b0b7a7/department-store-shopping-gty-jef-250624_1750772909541_hpMain_16x9.jpg?w=1600,2025-07-15T09:02:24Z,"An inflation report to be released on Tuesday will mark the latest test for President Donald Trump's tariff policy, which so far has averted the resurgence of inflation that many economists expected.… [+3142 chars]"
23,"{'id': None, 'name': 'NPR'}",Carrie Kahn,Brazil's Lula warns of 50% tariffs on U.S. goods after Trump trade threat,"Brazil's President Lula is firing back at Trump's 50% tariff threat — saying Brazil is ready to match any U.S. import taxes, dollar for dollar.",https://www.npr.org/2025/07/10/nx-s1-5463508/brazil-lula-trump-tariffs,https://npr.brightspotcdn.com/dims3/default/strip/false/crop/6000x3375+0+313/resize/1400/quality/100/format/jpeg/?url=http%3A%2F%2Fnpr-brightspot.s3.amazonaws.com%2Fbb%2F17%2F8c524c644d50a44a472d0f1ff754%2Fgettyimages-2223795979.jpg,2025-07-10T20:30:32Z,"RIO DE JANEIRO, Brazil Brazilian President Luiz Inácio Lula da Silva says the U.S. must respect his country and he's ready to impose retaliatory tariffs if President Donald Trump goes ahead with a th… [+2773 chars]"
24,"{'id': None, 'name': 'Yahoo Entertainment'}",Nilanjan Banerjee,Pick Enbridge Stock Over Enterprise Products in Today's Energy Market?,"ENB outpaces EPD with stronger cash flow stability, clean energy investments and rising 2025 earnings estimates.",https://finance.yahoo.com/news/pick-enbridge-stock-over-enterprise-143000162.html,https://media.zenfs.com/en/zacks.com/9ce82b97eea8b86645c0f5ef96de195f,2025-07-25T14:30:00Z,"Enbridge Inc. ENB and Enterprise Products Partners EPD are two midstream energy giants. Given the nature of their business model, where shippers utilize their oil and gas storage and transportation a… [+2326 chars]"
25,"{'id': None, 'name': 'Www.bsc.es'}",,Countries across the world see food price shocks from climate extremes,"&quot;Until we get to net-zero emissions, extreme weather will only get worse, and it&amp;#39;s already damaging crops and pushing up the price of food all over the world,&amp;rdquo; said Maximilian Kot",https://www.bsc.es/news/bsc-news/countries-across-the-world-see-food-price-shocks-climate-extremes-research-involving-bsc-shows,https://www.bsc.es/sites/default/files/public/styles/thumbnail/public/bscw2/content/news/horizontal-image/adobestock_115149363.jpeg?itok=jFqr7UW_,2025-07-23T03:57:02Z,"""Until we get to net-zero emissions, extreme weather will only get worse, and it's already damaging crops and pushing up the price of food all over the world,” said Maximilian Kotz, BSC researcher an… [+8132 chars]"
26,"{'id': 'business-insider', 'name': 'Business Insider'}","Brent D. Griffiths,Jordan Pandy",These 11 companies have left California over the years,"McKesson, Chevron, and Tesla are among the biggest companies to leave California in recent years.",https://www.businessinsider.com/companies-leaving-california-list-2025-7,https://i.insider.com/6883e7ed85e81483682eba5a?width=1200&format=jpeg,2025-07-27T09:14:02Z,"Many of the big companies that have left California had their roots in San Francisco and the Bay Area.Justin Sullivan/Getty Images
<ul><li>Big companies continue to leave California.</li><li>Overall… [+7394 chars]"
27,"{'id': None, 'name': 'Yahoo Entertainment'}",Elena Fabrichnaya,"Exclusive-Russia's VTB to gain billions of roubles if interest rates come down, CFO says","ST PETERSBURG, Russia (Reuters) -Every 1% cut in central bank interest rates gives Russia's VTB Bank an extra 20 billion roubles ($250 million) in net profit...",https://ca.finance.yahoo.com/news/exclusive-russias-vtb-gain-billions-131853941.html,https://media.zenfs.com/en/reuters.com/a03165980348ff2abe044c6c858978d9,2025-07-04T13:18:53Z,"By Elena Fabrichnaya
ST PETERSBURG, Russia (Reuters) -Every 1% cut in central bank interest rates gives Russia's VTB Bank an extra 20 billion roubles ($250 million) in net profit, CFO Dmitry Pyanov … [+3354 chars]"
28,"{'id': None, 'name': 'Thekitchn.com'}",Ali Domrongchai,The “Delicious” Pantry Staple I’ve Eaten Every Morning This Week,"It’s the best.
READ MORE...",https://www.thekitchn.com/cocomo-coconut-peanut-butter-review-23734857,"https://cdn.apartmenttherapy.info/image/upload/f_auto,q_auto:eco,c_fill,g_auto,w_1500,ar_3:2/tk%2Fedit%2Fgroceries%2F2025%2F2025-07%2Fcocomo-spread%2Fcocomo-spread-5",2025-07-11T12:30:00Z,"We independently select these products—if you buy from one of our links, we may earn a commission. All prices were accurate at the time of publishing.
One of my favorite ways to get out of monotonou… [+2265 chars]"
29,"{'id': None, 'name': 'Forbes'}","Tom Aspray, Contributor, 
 Tom Aspray, Contributor
 https://www.forbes.com/sites/tomaspray/",Crude Oil ‘s Seasonal And Technical Outlook,The recent rally in crude oil prices turned some positive on the energy stocks and ETFs.  The Viper Report’s Tom Aspray shares his technical and seasonal outlook.,https://www.forbes.com/sites/tomaspray/2025/07/24/crude-oil-s-seasonal-and-technicals-outlook/,https://imageio.forbes.com/specials-images/imageserve/6881f402aea6a40c8f591f9c/0x0.jpg?format=jpg&height=900&width=1600&fit=bounds,2025-07-24T09:01:15Z,"NEW YORK - APRIL 7: Traders work in the oil futures pit at the New York Mercantile Exchange April ... More 7, 2005 in New York City. (Photo by Stephen Chernin/Getty Images)
Getty Images
The NYMEX l… [+2840 chars]"
30,"{'id': None, 'name': 'Yahoo Entertainment'}",Laila Kearney,Analysis-America's largest power grid is struggling to meet demand from AI,"HARRISBURG, Pennsylvania (Reuters) -America's largest power grid is under strain as data centers and AI chatbots consume power faster than new plants can be ...",https://finance.yahoo.com/news/analysis-americas-largest-power-grid-102252311.html,https://media.zenfs.com/en/reuters.com/057e7df6259b8d4764236098c22e6b6f,2025-07-09T10:22:52Z,"By Laila Kearney
HARRISBURG, Pennsylvania (Reuters) -America's largest power grid is under strain as data centers and AI chatbots consume power faster than new plants can be built.
Electricity bill… [+5368 chars]"
31,"{'id': None, 'name': 'The Atlantic'}",Rogé Karma,"The Most Perverse Part of the ‘Big, Beautiful Bill’",The Republican megabill could be setting America up for the worst energy-affordability crisis since the 1970s.,https://www.theatlantic.com/politics/archive/2025/07/congress-electricity-tax-cuts/683416/,https://cdn.theatlantic.com/thumbor/A-zzsct7zKWhKHcLRKTaheqP1l0=/0x43:2000x1085/1200x625/media/img/mt/2025/07/2025_electricity_up_bk2/original.jpg,2025-07-03T16:45:00Z,"Of all the elements of the One Big Beautiful Bill Act, perhaps none is as obviously self-defeating as getting rid of tax credits for clean energy. That decision will not simply set back the fight aga… [+8272 chars]"
32,"{'id': None, 'name': 'Gizmodo.com'}",Brittany Vincent,This 4.8-Star bella PRO 8-Qt Air Fryer Is Nearly 50% Off in a Best Buy Exclusive Deal to Counter Prime Day,Make meal time in a short time with this affordable Air Fryer for under $70.,https://gizmodo.com/this-4-8-star-bella-pro-8-qt-air-fryer-is-nearly-50-off-in-a-best-buy-exclusive-deal-to-counter-prime-day-2000621454,https://gizmodo.com/app/uploads/2025/06/bellapro-1200x675.jpg,2025-06-30T16:40:20Z,"An air fryer is one of the most versatile, most helpful devices you’ll ever add to your kitchen. The way it can take something that might require you to spend a while slaving over a hot oven and turn… [+2043 chars]"
33,"{'id': None, 'name': 'BBC News'}",,"Is the 'big, beautiful' India-US trade deal in trouble?","With days to go before 9 July, when the tariff pause ends, hopes persist but negotiations are tough.",https://www.bbc.com/news/articles/c625504qp3go,https://ichef.bbci.co.uk/news/1024/branded_news/3c75/live/5346c6b0-5638-11f0-b5c5-012c5796682d.jpg,2025-07-01T06:40:48Z,"Is the ""big, beautiful"" India-US trade deal slipping out of reach?
With just days to go before a 9 July deadline set by US President Donald Trump's administration, hopes of clinching an interim trad… [+5669 chars]"
34,"{'id': None, 'name': 'Biztoc.com'}",breakingthenews.net,Oil climbs 1% amid geopolitical tensions,"Crude oil prices rose by more than 1% on Thursday after Iraq stated that the recent attacks in the country's northern Kurdish region led to several oil facilities being shut down, slashing Iraq's oil ...",https://biztoc.com/x/da4d7086c4c07271,https://biztoc.com/cdn/da4d7086c4c07271_s.webp,2025-07-17T17:52:57Z,"Crude oil prices rose by more than 1% on Thursday after Iraq stated that the recent attacks in the country's northern Kurdish region led to several oil facilities being shut down, slashing Iraq's oil… [+69 chars]"
35,"{'id': None, 'name': 'The Atlantic'}",Ron Davis,The Biggest Myth About the YIMBY Movement,There’s nothing centrist or conservative about the push to lower housing costs.,https://www.theatlantic.com/ideas/archive/2025/07/housing-abundance-antitrust/683504/,https://cdn.theatlantic.com/thumbor/sZBmjmG47O81dQJMiv8W5jOa5Jo=/0x43:2000x1085/1200x625/media/img/mt/2025/07/2025_07_09_Davis_Democrats_Abundance_Antitrust-1/original.jpg,2025-07-14T11:30:00Z,"Over the past year, the conversation about housing affordability went national. Unfortunately, it brought with it all the contentiousness of a local-zoning-board meeting. The Democratic YIMBY (“yes i… [+9229 chars]"
36,"{'id': 'the-times-of-india', 'name': 'The Times of India'}",ET Now,Energy stocks unlikely to rally without crude surge: Anand Tandon,"Anand Tandon suggests limited near-term movement in the energy sector, favoring grid infrastructure investments over oil and solar. While geopolitical tensions and Russian oil sanctions exist, their impact is mitigated by weak global demand and refined produc…",https://economictimes.indiatimes.com/markets/expert-view/energy-stocks-unlikely-to-rally-without-crude-surge-anand-tandon/articleshow/122850324.cms,"https://img.etimg.com/thumb/msid-122850296,width-1200,height-630,imgsize-29628,overlay-etmarkets/articleshow.jpg",2025-07-23T04:49:04Z,"""In the near term, I dont expect any significant movement. The only change we might see is if crude prices rise sustainablythen ONGC might tick up slightly. On the power side, if we include that with… [+3635 chars]"
